{
  "schema_version": 1,
  "generated": "2026-05-04",
  "notes": "Controlled vocabulary for selector_tags fields per matrix_storage_design.md amendment 2. Free strings are forbidden in selector_tags.{domains, problem_classes, tags, excludes}; values must be drawn from these lists. Adding a value requires a PR + a registry schema_version minor bump.",

  "domains": [
    "mechanical",
    "manufacturing",
    "industrial-design",
    "materials-science",
    "aerospace",
    "automotive",
    "civil",
    "structural",
    "process-engineering",
    "chemical",
    "electrical",
    "electronics",
    "thermal",
    "energy-systems",
    "consumer-product",
    "biomedical-device",
    "software",
    "ai-ml",
    "data-systems",
    "cybersecurity",
    "ux",
    "service",
    "healthcare",
    "hospitality",
    "telehealth",
    "fintech",
    "payments",
    "supply-chain",
    "logistics",
    "governance",
    "regulatory",
    "public-health",
    "policy",
    "compliance",
    "pharmaceutical",
    "drug-safety",
    "bio",
    "biology",
    "biomimetics",
    "ecology",
    "sustainability",
    "circular-economy",
    "education",
    "training",
    "patent-analysis",
    "general-engineering"
  ],

  "problem_classes": [
    "engineering-contradiction",
    "physical-contradiction",
    "service-quality-gap",
    "governance-tension",
    "biological-design",
    "information-systems",
    "multi-stakeholder-coordination",
    "regulatory-design",
    "patent-circumvention"
  ],

  "tags": [
    "physical-product",
    "patent-derived",
    "patent-1985-2002",
    "curated-subset",
    "extended-50-param",
    "llm-generated",
    "bilingual",
    "russian-names",
    "governance-reframed",
    "service-quality-hybrid",
    "biology-derived",
    "technology-derived",
    "shell-only",
    "canonical",
    "experimental",
    "ai-curated",
    "operational-fields-6",
    "ariz-companion",
    "teaching-baseline",
    "harm-reduction-focus",
    "structural-integrity-focus",
    "manufacturing-trade-offs"
  ],

  "exotic_signals": [
    "security",
    "compatibility",
    "sustainability",
    "noise",
    "harmful-emissions",
    "safety",
    "scalability",
    "controllability",
    "aesthetics",
    "information-capacity",
    "governance",
    "public-trust",
    "regulatory-burden",
    "bio-analogy",
    "service-experience",
    "patient-experience",
    "compliance-burden"
  ],

  "domain_signals": [
    "mechanical",
    "manufacturing",
    "structural",
    "thermal",
    "electrical",
    "software",
    "fintech",
    "payments",
    "healthcare",
    "telehealth",
    "service",
    "governance",
    "pharmaceutical",
    "bio",
    "biology",
    "regulatory",
    "policy",
    "supply-chain",
    "consumer-product",
    "aerospace",
    "automotive",
    "biomedical-device",
    "energy-systems",
    "data-systems",
    "ai-ml"
  ],

  "contradiction_types": [
    "engineering-contradiction",
    "physical-contradiction",
    "service-quality-gap",
    "governance-tension"
  ],

  "domain_classes": [
    "mechanical",
    "manufacturing",
    "thermal",
    "electrical",
    "software",
    "service",
    "governance",
    "bio",
    "hybrid",
    "general-engineering"
  ],

  "interpretation_lineages": [
    "altshuller-40",
    "biotriz-40",
    "drug-safety-reframed",
    "triz-ai-extended"
  ],

  "matrix_statuses": [
    "canonical",
    "variant",
    "derived",
    "domain",
    "experimental",
    "shell",
    "identical-duplicate"
  ]
}
